<?xml version="1.0" encoding="UTF-8"?>
<xsd:schema
            xmlns:xsd="http://www.w3.org/2001/XMLSchema"
	    xmlns:xs="http://www.w3.org/2001/XMLSchema" version="0.1" elementFormDefault="qualified">

  <xsd:element name="TableList" id="d2e37">
    <xsd:complexType>
      <xsd:sequence>
        <xsd:element name="Table" minOccurs="1" maxOccurs="unbounded">
          <xsd:complexType>
            <xsd:sequence>
              <xsd:element name="Field" minOccurs="1" maxOccurs="unbounded">
                <xsd:complexType>
                  <xsd:simpleContent>
                    <xsd:extension base="xsd:string">
                      <xsd:attribute name="T_NAME" id="d2e141" use="required">
                        <xsd:simpleType>
                          <xsd:restriction base="xsd:string">
                            <xsd:maxLength value="128"/>
                          </xsd:restriction>
                        </xsd:simpleType>
                      </xsd:attribute>
                      <xsd:attribute name="T_TYPE" id="d2e151" use="required">
                        <xsd:simpleType>
                          <xsd:restriction base="xsd:string">
                            <xsd:enumeration value="FT_BINARY" />
                            <xsd:enumeration value="FT_CHR" />
                            <xsd:enumeration value="FT_DATE" />
                            <xsd:enumeration value="FT_DECIMAL" />
                            <xsd:enumeration value="FT_DOUBLE" />
                            <xsd:enumeration value="FT_DOUBLEG" />
                            <xsd:enumeration value="FT_DOUBLEM" />
                            <xsd:enumeration value="FT_DOUBLER" />
                            <xsd:enumeration value="FT_FLOAT" />
                            <xsd:enumeration value="FT_FLOATG" />
                            <xsd:enumeration value="FT_INT16" />
                            <xsd:enumeration value="FT_INT32" />
                            <xsd:enumeration value="FT_INT64" />
                            <xsd:enumeration value="FT_LDMON" />
                            <xsd:enumeration value="FT_LDMONR" />
                            <xsd:enumeration value="FT_LDOUBLE" />
                            <xsd:enumeration value="FT_LMONEYR_OLD" />
                            <xsd:enumeration value="FT_LMONEY_OLD" />
                            <xsd:enumeration value="FT_MONEYR_OLD" />
                            <xsd:enumeration value="FT_MONEY_OLD" />
                            <xsd:enumeration value="FT_NUMERIC" />
                            <xsd:enumeration value="FT_NUMSTR" />
                            <xsd:enumeration value="FT_SHTM" />
                            <xsd:enumeration value="FT_SNR" />
                            <xsd:enumeration value="FT_STRING" />
                            <xsd:enumeration value="FT_TIME" />
                            <xsd:enumeration value="FT_UCHR" />
                          </xsd:restriction>
                        </xsd:simpleType>
                      </xsd:attribute>
                      <xsd:attribute name="T_SIZE" type="xsd:integer" id="d2e159" use="required" />
                      <xsd:attribute name="T_OUTLEN" type="xsd:integer" id="d2e169" use="required" />
                      <xsd:attribute name="T_DECPOINT" type="xsd:integer" id="d2e179" use="required" />
                      <xsd:attribute name="T_HIDDEN" type="xsd:boolean" id="d2e190" use="required" />
                      <xsd:attribute name="T_COMMENT" id="d2e198" use="required">
                        <xsd:simpleType>
                          <xsd:restriction base="xsd:string">
                            <xsd:maxLength value="128"/>
                          </xsd:restriction>
                        </xsd:simpleType>
                      </xsd:attribute>
                    </xsd:extension>
                  </xsd:simpleContent>
                </xsd:complexType>
              </xsd:element>
              <xsd:element name="Key" minOccurs="0" maxOccurs="unbounded">
                <xsd:complexType>
                  <xsd:sequence>
                    <xsd:element name="Segment" minOccurs="1" maxOccurs="unbounded">
                      <xsd:complexType>
                        <xsd:simpleContent>
                          <xsd:extension base="xsd:string">
                            <xsd:attribute name="T_FIELD" id="d2e286" use="required">
                              <xsd:simpleType>
                                <xsd:restriction base="xsd:string">
                                  <xsd:maxLength value="128"/>
                                </xsd:restriction>
                              </xsd:simpleType>
                            </xsd:attribute>
                            <xsd:attribute name="TF_ALTERNATE" type="xsd:boolean" id="d2e294" use="required" />
                            <xsd:attribute name="TF_DESCENDING" type="xsd:boolean" id="d2e302" use="required" />
                            <xsd:attribute name="TF_LOCAL" type="xsd:boolean" id="d2e310" use="required">
                            </xsd:attribute>
                            <xsd:attribute name="T_TYPE" id="d2e318" use="required">
                              <xsd:simpleType>
                                <xsd:restriction base="xsd:string">
                                  <xsd:enumeration value="Eautoinc" />
                                  <xsd:enumeration value="Ebfloat" />
                                  <xsd:enumeration value="Ecurrency" />
                                  <xsd:enumeration value="Edate" />
                                  <xsd:enumeration value="Edecimal" />
                                  <xsd:enumeration value="Efloat" />
                                  <xsd:enumeration value="Einteger" />
                                  <xsd:enumeration value="Elogical" />
                                  <xsd:enumeration value="Elstring" />
                                  <xsd:enumeration value="Emoney" />
                                  <xsd:enumeration value="Enumeric" />
                                  <xsd:enumeration value="Estring" />
                                  <xsd:enumeration value="Etime" />
                                  <xsd:enumeration value="Eunbin" />
                                  <xsd:enumeration value="Ezstring" />
                                </xsd:restriction>
                              </xsd:simpleType>
                            </xsd:attribute>
                            <xsd:attribute name="T_NULLVAL" type="xsd:integer" id="d2e327" use="required" />
                            <xsd:attribute name="T_ISREAL" type="xsd:boolean" id="d2e335" use="required">
                            </xsd:attribute>
                            <xsd:attribute name="T_COMMENT" id="d2e343" use="required">
                              <xsd:simpleType>
                                <xsd:restriction base="xsd:string">
                                  <xsd:maxLength value="128"/>
                                </xsd:restriction>
                              </xsd:simpleType>
                            </xsd:attribute>
                          </xsd:extension>
                        </xsd:simpleContent>
                      </xsd:complexType>
                    </xsd:element>
                  </xsd:sequence>
                  <xsd:attribute name="T_KEYNUM" type="xsd:integer" id="d2e213" use="required" />
                  <xsd:attribute name="TF_DUPLICATES" type="xsd:boolean" id="d2e223" use="required" />
                  <xsd:attribute name="TF_MODIFIABLE" type="xsd:boolean" id="d2e231" use="required" />
                  <xsd:attribute name="TF_BINARY" type="xsd:boolean" id="d2e239" use="required" />
                  <xsd:attribute name="TF_NULLVAL" type="xsd:boolean" id="d2e247" use="required" />
                  <xsd:attribute name="TF_SUPPLEMENT" type="xsd:boolean" id="d2e256" use="required" />
                  <xsd:attribute name="TF_EXTENDED" type="xsd:boolean"  id="d2e264" use="required" />
                  <xsd:attribute name="TF_MANUAL" type="xsd:boolean" id="d2e272" use="required" />
                </xsd:complexType>
              </xsd:element>
            </xsd:sequence>
            <xsd:attribute name="T_NAME" id="d2e50" use="required">
              <xsd:simpleType>
                <xsd:restriction base="xsd:string">
                  <xsd:maxLength value="30"/>
                </xsd:restriction>
              </xsd:simpleType>
            </xsd:attribute>
            <xsd:attribute name="T_OWNER" id="d2e60" use="required">
              <xsd:simpleType>
                <xsd:restriction base="xsd:string">
                  <xsd:maxLength value="9"/>
                </xsd:restriction>
              </xsd:simpleType>
            </xsd:attribute>
            <xsd:attribute name="T_CACHESIZE" type="xsd:integer" id="d2e70" use="required" />
            <xsd:attribute name="T_PKIDX" type="xsd:integer" id="d2e80" use="required" />
            <xsd:attribute name="T_BLOBTYPE" id="d2e90" use="required">
              <xsd:simpleType>
                <xsd:restriction base="xsd:string">
                  <xsd:enumeration value="BT_BLOB_NO" />
                  <xsd:enumeration value="BT_BLOB_VAR" />
                  <xsd:enumeration value="BT_BLOB_STREAM" />
                  <xsd:enumeration value="BT_CLOB" />
                </xsd:restriction>
              </xsd:simpleType>
            </xsd:attribute>
            <xsd:attribute name="T_BLOBLEN" type="xsd:integer" id="d2e99" use="required" />
            <xsd:attribute name="TF_TEMPORARY" type="xsd:boolean" id="d2e109" use="required" />
            <xsd:attribute name="TF_STRUCT" type="xsd:boolean" id="d2e117" use="required" />
            <xsd:attribute name="T_COMMENT" id="d2e125" use="required">
              <xsd:simpleType>
                <xsd:restriction base="xsd:string">
                  <xsd:maxLength value="40"/>
                </xsd:restriction>
              </xsd:simpleType>
            </xsd:attribute>
          </xsd:complexType>
        </xsd:element>
      </xsd:sequence>
    </xsd:complexType>
  </xsd:element>

</xsd:schema>

