<?xml version="1.0" encoding="UTF-8"?>
<TableList xmlns:xsi="http://www.w3.org/2001/XMLSchema-instance"
    xsi:schemaLocation="http://www.softlab.ru fmtxml.xsd"
    xmlns="http://www.softlab.ru">
  <Table T_NAME="dregval_dbt" T_OWNER="" T_CACHESIZE="0" T_PKIDX="0" T_BLOBTYPE="BT_BLOB_VAR" T_BLOBLEN="2048" TF_TEMPORARY="false" TF_STRUCT="false" T_COMMENT="Значение настройки банка">
    <Field T_NAME="t_keyid" T_TYPE="FT_INT32" T_SIZE="4" T_OUTLEN="10" T_DECPOINT="0" T_HIDDEN="false" T_COMMENT="Идентификатор настройки"/>
    <Field T_NAME="t_regkind" T_TYPE="FT_INT32" T_SIZE="4" T_OUTLEN="0" T_DECPOINT="1" T_HIDDEN="false" T_COMMENT="Вид значения настройки"/>
    <Field T_NAME="t_objectid" T_TYPE="FT_INT32" T_SIZE="4" T_OUTLEN="4" T_DECPOINT="0" T_HIDDEN="false" T_COMMENT="Идентификатор объекта"/>
    <Field T_NAME="t_blockuservalue" T_TYPE="FT_CHR" T_SIZE="1" T_OUTLEN="1" T_DECPOINT="0" T_HIDDEN="false" T_COMMENT="Запрет действия пользовательских значений"/>
    <Field T_NAME="t_expdep" T_TYPE="FT_INT16" T_SIZE="2" T_OUTLEN="0" T_DECPOINT="0" T_HIDDEN="false" T_COMMENT="Порядок распространения по ТС"/>
    <Field T_NAME="t_lintvalue" T_TYPE="FT_INT32" T_SIZE="4" T_OUTLEN="10" T_DECPOINT="0" T_HIDDEN="false" T_COMMENT="Значение целого типа"/>
    <Field T_NAME="t_ldoublevalue" T_TYPE="FT_DOUBLE" T_SIZE="8" T_OUTLEN="10" T_DECPOINT="4" T_HIDDEN="false" T_COMMENT="Значение действительного типа"/>
    <Key T_KEYNUM="0" TF_DUPLICATES="false" TF_MODIFIABLE="true" TF_BINARY="false" TF_NULLVAL="false" TF_SUPPLEMENT="false" TF_EXTENDED="true" TF_MANUAL="false">
      <Segment T_FIELD="t_keyid" TF_ALTERNATE="false" TF_DESCENDING="false" TF_LOCAL="false" T_TYPE="Einteger" T_NULLVAL="0" T_ISREAL="true" T_COMMENT="Индекс &quot;Alternate Key1&quot; (&quot;XAK1_DREGVAL_DBT&quot;). (#00)"/>
      <Segment T_FIELD="t_regkind" TF_ALTERNATE="false" TF_DESCENDING="false" TF_LOCAL="false" T_TYPE="Einteger" T_NULLVAL="0" T_ISREAL="true" T_COMMENT="Индекс &quot;Alternate Key1&quot; (&quot;XAK1_DREGVAL_DBT&quot;). (#01)"/>
      <Segment T_FIELD="t_objectid" TF_ALTERNATE="false" TF_DESCENDING="false" TF_LOCAL="false" T_TYPE="Einteger" T_NULLVAL="0" T_ISREAL="true" T_COMMENT="Индекс &quot;Alternate Key1&quot; (&quot;XAK1_DREGVAL_DBT&quot;). (#02)"/>
    </Key>
    <Key T_KEYNUM="1" TF_DUPLICATES="true" TF_MODIFIABLE="true" TF_BINARY="false" TF_NULLVAL="false" TF_SUPPLEMENT="false" TF_EXTENDED="true" TF_MANUAL="false">
      <Segment T_FIELD="t_regkind" TF_ALTERNATE="false" TF_DESCENDING="false" TF_LOCAL="false" T_TYPE="Einteger" T_NULLVAL="0" T_ISREAL="true" T_COMMENT=" (#00)"/>
      <Segment T_FIELD="t_objectid" TF_ALTERNATE="false" TF_DESCENDING="false" TF_LOCAL="false" T_TYPE="Einteger" T_NULLVAL="0" T_ISREAL="true" T_COMMENT=" (#01)"/>
    </Key>
  </Table>
</TableList>
